418.	Фильтр дыхательный (тепловлагообменник/бактериальный фильтр), соответствующий коду 324650 вида медицинского изделия в соответствии с номенклатурной классификацией	32.50.13.190, 32.50.50, 32.50.50.190, 32.50.13.150, 32.50.21.120, 32.50.21.121, 32.50.21.122, 32.50.21.123, 32.50.21.129
419.	Фильтр дыхательный (бактериальный для медицинских газов), соответствующий коду 322250 вида медицинского изделия в соответствии с номенклатурной классификацией	32.50.13.190, 32.50.50, 32.50.50.190, 32.50.13.150, 32.50.21.120, 32.50.21.121, 32.50.21.122, 32.50.21.123, 32.50.21.129
420.	Набор расходных материалов для сбора плазмы методом центрифугирования, соответствующий кодам 262850, 262870 вида медицинского изделия в соответствии с номенклатурной классификацией	32.50.13.190, 32.50.50, 32.50.50.180, 32.50.50.190
421.	Набор однокамерных контейнеров для донорского плазмафереза, соответствующий кодам 262870, 350020 вида медицинского изделия в соответствии с номенклатурной классификацией	32.50.13.190, 32.50.50, 32.50.50.180, 32.50.50.190
422.	Набор двухкамерных контейнеров для донорского плазмафереза, соответствующий кодам 262870, 350020 вида медицинского изделия в соответствии с номенклатурной классификацией	32.50.13.190, 32.50.50, 32.50.50.180, 32.50.50.190
423.	Набор трехкамерных контейнеров для донорского плазмафереза, соответствующий кодам 262870, 350020 вида медицинского изделия в соответствии с номенклатурной классификацией	32.50.13.190, 32.50.50, 32.50.50.180, 32.50.50.190
424.	Комплект магистралей для аппарата донорского плазмафереза, соответствующий коду 262870 вида медицинского изделия в соответствии с номенклатурной классификацией	32.50.13.190, 32.50.50, 32.50.50.180, 32.50.50.190
425.	Набор расходных материалов для аппарата донорского тромбоцитафереза, соответствующий кодам 262850, 262870 вида медицинского изделия в соответствии с номенклатурной классификацией	32.50.13.190, 32.50.50, 32.50.50.180, 32.50.50.190
426.	Контейнер с антикоагулянтом для донорского плазмафереза или для консервирования компонентов крови, соответствующий кодам 145450, 145500, 262850 вида медицинского изделия в соответствии с номенклатурной классификацией	32.50.13.190, 32.50.50, 32.50.50.180, 21.20.23.199, 32.50.50.190
427.	Контейнер с антикоагулянтом цитрат натрия 4% для донорского плазмафереза, соответствующий кодам 145450, 145500, 262850 вида медицинского изделия в соответствии с номенклатурной классификацией	32.50.13.190, 32.50.50, 32.50.50.180, 21.20.23.199, 32.50.50.190
428.	Контейнер с раствором антикоагулянта и (или) консерванта для донорского тромбоцитафереза, соответствующий кодам 145450, 145500, 262850 вида медицинского изделия в соответствии с номенклатурной классификацией	32.50.13.190, 32.50.50, 32.50.50.180, 21.20.23.199, 32.50.50.190
429.	Калоприемник однокомпонентный закрытого типа, соответствующий коду 152450 вида медицинского изделия в соответствии с номенклатурной классификацией	32.50.13.190, 32.50.13.110, 32.50.50.141
430.	Калоприемник однокомпонентный открытого типа, соответствующий коду 156410 вида медицинского изделия в соответствии с номенклатурной классификацией	32.50.13.190, 32.50.13.110, 32.50.50.141
431.	Мочеприемник однокомпонентный, не носимый, соответствующий кодам 152470, 152480, 156370 вида медицинского изделия в соответствии с номенклатурной классификацией	32.50.13.190, 32.50.13.110, 32.50.50.141
432.	Мочеприемник однокомпонентный, носимый, соответствующий кодам 152430, 156400, 156390 вида медицинского изделия в соответствии с номенклатурной классификацией	32.50.13.190, 32.50.13.110, 32.50.50.141
433.	Препараты лекарственные	21.10.51, 21.20.1, 21.20.21, 21.20.23
434.	Огурцы	01.13.32
435.	Томаты (помидоры)	01.13.34
436.	Продукция из рыбы свежая, охлажденная или мороженая	10.20.1
437.	Рыба, приготовленная или консервированная другим способом; икра и заменители икры	10.20.2
438.	Ракообразные, моллюски и прочие беспозвоночные водные, мороженые, переработанные или консервированные	10.20.3
439.	Соль пищевая выварочная	10.84.30.120
440.	Соль пищевая поваренная йодированная	10.84.30.130
441.	Говядина парная, остывшая или охлажденная	10.11.11.110
442.	Телятина парная, остывшая или охлажденная	10.11.11.120
443.	Свинина парная, остывшая или охлажденная, в том числе для детского питания	10.11.12
444.	Субпродукты пищевые крупного рогатого скота парные, остывшие или охлажденные	10.11.20.110
445.	Мясо крупного рогатого скота (говядина и телятина) замороженное, в том числе для детского питания	10.11.31
446.	Свинина замороженная, в том числе для детского питания	10.11.32
447.	Мясо птицы охлажденное, в том числе для детского питания	10.12.1
448.	Субпродукты домашней птицы пищевые замороженные	10.12.40.120
449.	Молоко и сливки сухие, сублимированные	10.51.2
450.	Масло сливочное	10.51.30.100
451.	Масло сливочное	10.51.30.110
452.	Пасты масляные	10.51.30.200
453.	Пасты масляные	10.51.30.210
454.	Сыры, продукты сырные и творог	10.51.4, за исключением 10.51.40.120
455.	Молоко и сливки, сгущенные или с добавками сахара или других подслащивающих веществ, не сухие	10.51.51
456.	Рис шелушеный	10.61.11.000
457.	Сахар белый свекловичный или тростниковый и химически чистая сахароза в твердом состоянии без вкусоароматических или красящих добавок	10.81.12
458.	Сахар рафинированный свекловичный или тростниковый со вкусоароматическими или красящими добавками; кленовый сахар и кленовый сироп	10.81.13
459.	Коньяки	11.01.10.140
460.	Бренди	11.01.10.160
461.	Вина игристые	11.02.11.110
462.	Вина	11.02.12.110
463.	Вина ликерные	11.02.12.120
464.	Вина крепленые	11.02.12.160
465.	Вина фруктовые (плодовые)	11.03.10.110
