327.	Коммутаторы элементные, командоаппараты, контроллеры, переключатели барабанные, пускатели ручные, выключатели разные (только в отношении контроллеров, микропроцессорных преобразователей величин)	27.33.13.161
328.	Лампы накаливания или газоразрядные лампы; дуговые лампы; светодиодные лампы	27.40.1
329.	Светильники электрические настольные, прикроватные или напольные	27.40.22
330.	Указатели светящиеся, световые табло и подобные им устройства	27.40.24
331.	Люстры и прочие устройства осветительные электрические подвесные, потолочные, встраиваемые и настенные	27.40.25
332.	Лампы-вспышки фотографические, фотоосветители типа "кубик" и аналогичные изделия	27.40.31
333.	Прожекторы и аналогичные светильники узконаправленного света	27.40.33
334.	Светильники медицинские, соответствующие кодам 129360, 187160 вида медицинского изделия в соответствии с номенклатурной классификацией	27.40.39, 32.50.50.190
335.	Части светильников и осветительных устройств	27.40.42
336.	Приборы электромеханические бытовые хозяйственные со встроенным электродвигателем прочие, не включенные в другие группировки	27.51.21.119
337.	Машины и приборы для механизации кухонных работ	27.51.21.120
338.	Утюги электрические	27.51.23.130
339.	Электрочайники	27.51.24.110
340.	Приборы электронагревательные бытовые прочие, не включенные в другие группировки	27.51.24.190
341.	Кипятильники погружные электрические	27.51.25.120
342.	Печи микроволновые	27.51.27.000
343.	Анализаторы частиц	27.90.11.171
344.	Приборы световой и звуковой сигнализации электрические	27.90.20.120
345.	Генераторы сигналов электрические	27.90.40.150
346.	Оборудование электрическое прочее, не включенное в другие группировки	27.90.40.190
347.	Устройства электрической сигнализации, электрооборудование для обеспечения безопасности или управления движением на железных дорогах, трамвайных путях, автомобильных дорогах, внутренних водных путях, площадках для парковки, в портовых сооружениях или на аэродромах	27.90.70
348.	Машины, содержащие счетные устройства, прочие, не включенные в другие группировки	28.23.13.190
349.	Машины офисные прочие	28.23.23
350.	Медицинские морозильники, холодильники комбинированные лабораторные, холодильники фармацевтические, соответствующие кодам 122990, 143910, 145090, 215850, 261620, 321680 вида медицинского изделия в соответствии с номенклатурной классификацией	28.25.13.110, 28.25.13.116, 32.50.50
351.	Оборудование и аппаратура, исключительно или в основном используемые для производства полупроводниковых слитков или пластин, полупроводниковых устройств, электронных интегральных микросхем или плоскопанельных дисплеев	28.99.20
352.	Тахографы	29.32.30.163
353.	Аппараты электрохирургические, соответствующие кодам 119890, 126550, 127830, 172260, 228980, 228990, 229000, 260140, 260500, 268390, 282800, 282950 вида медицинского изделия в соответствии с номенклатурной классификацией	32.50.1, 32.50.13.190
354.	Стерилизаторы хирургические или лабораторные	32.50.12
355.	Аппараты для ингаляционного наркоза (за исключением аппаратов искусственной вентиляции легких, соответствующих кодам 232870, 232890 вида медицинского изделия в соответствии с номенклатурной классификацией)	32.50.21.121
356.	Аппараты дыхательные реанимационные (за исключением аппаратов искусственной вентиляции легких, соответствующих кодам 232870, 232890 вида медицинского изделия в соответствии с номенклатурной классификацией)	32.50.21.122
357.	Оборудование дыхательное прочее, не включенное в другие группировки	32.50.21.129
358.	Инкубаторы для новорожденных	32.50.21.160
359.	Ванна ультразвуковая для очистки и дезинфекции инструментов, соответствующая коду 127550 вида медицинского изделия в соответствии с номенклатурной классификацией	32.50.50, 32.50.50.190
360.	Облучатели-рециркуляторы воздуха, рециркуляторы бактерицидные, соответствующие кодам 131980, 132020, 132060, 132070, 152690, 152700, 160030, 270540, 292620, 375930 вида медицинского изделия в соответствии с номенклатурной классификацией	32.50.50.190
361.	Консоли подвода медицинских газов и электропитания, соответствующие кодам 259390, 259380, 157680, 335650 вида медицинского изделия в соответствии с номенклатурной классификацией	32.99.59
362.	Изделия санитарно-гигиенические - абсорбирующее белье (подгузники (за исключением размера XS (сверхмалые), пеленки)	17.22.12.130, 32.50.50.149, 13.95.10.190, 32.50.50
363.	Микроисточники с йодом-125	26.60.11.130
364.	Медицинские изделия, содержащие антисептические и дезинфицирующие препараты	20.20.14.000
365.	Питательные среды селективные и неселективные	20.59.52.140, 20.59.52.150
366.	Наборы реагентов для неонатального скрининга в сухих пятнах крови	21.20.23.110
367.	Наборы (комплекты) реагентов для гематологических анализаторов	21.20.23.110
368.	Наборы биохимических реагентов для определения ферментов	20.59.52.199, 21.20.23.111, 21.20.23.110
369.	Наборы реагентов для выявления инфекционных агентов методом полимеразной цепной реакции; наборы реагентов для количественного и качественного определения иммуноглобулинов или антигенов инфекционных агентов методом иммуноферментного анализа; наборы реагентов для количественного определения гормонов методом иммуноферментного анализа	21.10.60.196, 20.59.52.195, 21.20.23.110, 21.20.21.110
370.	Наборы биохимических реагентов для определения факторов свертывания крови	21.20.23.110
371.	Тест-полоски для определения содержания глюкозы в крови, соответствующие коду 248900 вида медицинского изделия в соответствии с номенклатурной классификацией	21.20.23.110
372.	Наборы биохимических реагентов для определения субстратов; наборы реагентов для определения групп крови и резус-фактора; наборы реагентов для фенотипирования крови человека по групповым системам резус, Келл и Кидд	21.20.23.111, 21.20.23.110, 32.50.13.190
373.	Материалы клейкие перевязочные, в том числе пропитанные или покрытые лекарственными средствами	21.20.24.110, 21.20.24.160
374.	Бинты стерильные и нестерильные марлевые	21.20.24.131, 21.20.24.130
375.	Маски марлевые медицинские стерильные и нестерильные; отрезы марлевые медицинские стерильные и нестерильные; пакеты перевязочные медицинские стерильные; тампоны, сетоны, турунды, шарики марлевые стерильные и нестерильные	13.20.44.120, 21.20.24.131, 21.20.24.140, 21.20.24.150, 21.20.24.169, 32.50.50.190
376.	Повязки и покрытия раневые, пропитанные или покрытые лекарственными средствами; салфетки антисептические спиртовые; салфетки марлевые медицинские стерильные и нестерильные	20.20.14.000, 21.20.10.158, 21.20.24.110, 21.20.24.150, 21.20.24.160, 21.20.24.170, 21.20.24.169, 32.50.50
377.	Матрацы противопролежневые ортопедические с эффектом запоминания формы; матрацы противопролежневые с гелевыми элементами; подушки противопролежневые ортопедические с эффектом запоминания формы	13.92.24.141, 31.03.12.140, 32.50.22.125, 32.50.22.129, 32.50.50
378.	Контейнеры для биопроб полимерные	22.22.14, 22.29.29.130, 32.50.50.190, 22.22.14.190, 32.50.13.190, 20.59.52.150
379.	Микроскопы медицинские; микроскопы для клинической лабораторной диагностики; микроскопы биологические	26.60.12.119, 26.70.22.150
380.	Аппараты ультразвуковые хирургические	26.60.12.132, 26.60.13.130, 26.60.13.190
381.	Коагуляторы хирургические	26.60.13.130
382.	Аппараты лазерные терапевтические	26.60.13.170, 26.60.13.190
383.	Слуховые аппараты неимплантируемые	26.60.14.120
384.	Иглы корневые	32.50.13.190
385.	Иглы хирургические; инструменты колющие; шприцы	32.50.13.110, 21.20.24.120, 32.50.50.190
386.	Лампы щелевые; микрохирургические инструменты для офтальмологии; набор пробных очковых линз офтальмологический	26.60.12.119, 32.50.13.110, 32.50.13.120, 32.50.13.121, 32.50.13.131, 32.50.13.190
387.	Линзы интраокулярные	32.50.13.120, 32.50.22.181
388.	Боры зубные твердосплавные; головки стоматологические алмазные, в том числе фасонные; емкости для взятия, хранения и транспортировки биологических проб для выполнения клинических лабораторных исследований, а именно пробирки для взятия капиллярной крови, емкости для мочи, кала и мокроты; зеркала гинекологические полимерные по Куско; зонды урогенитальные; иглодержатели микрохирургические; инструменты вспомогательные; инструменты зондирующие, бужирующие; инструменты многоповерхностного воздействия; инструменты оттесняющие; инструменты режущие и ударные с острой (режущей) кромкой; каналонаполнители; микромоторы пневматические для наконечников стоматологических; модули медицинские климатизированные (чистое помещение); наборы гинекологические смотровые одноразовые стерильные; наконечники для микромоторов; наконечники стоматологические турбинные; ножницы микрохирургические; пинцеты микрохирургические; пульпоэкстракторы; фрезы зуботехнические; иглы корневые	22.29.29.130, 22.29.29.190, 32.50.11.110, 32.50.11.190, 32.50.13.110, 32.50.13.121, 32.50.13.131, 32.50.13.132, 32.50.13.139, 32.50.13.190, 32.50.22.140, 32.50.50.110, 32.50.50.190
389.	Оборудование терапевтическое (ванны и кабины душевые гидромассажные)	32.50.21.112, 32.50.21.150, 32.50.50.190
390.	Эндопротезы суставов конечностей	32.50.13.190, 32.50.22.110, 32.50.22.120, 32.50.22.190, 32.50.50
391.	Поручни для ванной и туалета (прямые, угловые, правые, левые)	32.50.22.120, 32.50.50
392.	Аппараты наружной фиксации; имплантаты для остеосинтеза	21.10.60.191, 32.50.22.127, 32.50.22.191, 32.50.22.199, 32.50.50
393.	Костыли	32.50.22.128, 32.50.22.129
394.	Кресла-стулья с санитарным оснащением; опоры (опоры-ходунки шагающие, опоры-ходунки на колесиках); поручни (перила) для самоподнимания угловые, прямые (линейные) и откидные; ходунки на колесах; ходунки шагающие складные, регулируемые по высоте	32.50.22.129, 32.50.50
395.	Обувь ортопедическая детская	32.50.22.150
396.	Экзопротезы грудных (молочных) желез на основе силиконового геля; средство замещения синовиальной жидкости	32.50.22.190, 32.50.22.129, 32.50.22.121, 32.50.50
397.	Оболочки косметические к активным протезам верхних конечностей; стопы искусственные пенополиуретановые; чехол для культи нижних конечностей	32.50.23, 14.31.10.249, 32.50.22.129, 32.50.23.190
398.	Наконечники полимерные нестерильные (стерильные) одноразовые к дозаторам пипеточным, соответствующие кодам 292810, 352690 вида медицинского изделия в соответствии с номенклатурной классификацией	32.50.50.190
399.	Трости опорные	32.50.50, 32.99.21.120
400.	Устройства для переливания кровезаменителей и инфузионных растворов (ПР), соответствующие кодам 136330, 375950 вида медицинского изделия в соответствии с номенклатурной классификацией	32.50.13.110, 32.50.13.190, 32.50.50, 32.50.50.190
401.	Устройства для переливания крови, компонентов крови и кровезаменителей (ПК), соответствующие коду 145570 вида медицинского изделия в соответствии с номенклатурной классификацией	32.50.13.110, 32.50.13.190, 32.50.50, 32.50.50.190
402.	Контейнеры для заготовки, хранения и транспортировки донорской крови и ее компонентов без гемоконсервантов, однокамерные (общий объем контейнера -  500 мл -  1000 мл), соответствующие кодам 145490, 350020 вида медицинского изделия в соответствии с номенклатурной классификацией	32.50.13.190, 32.50.50, 32.50.50.180, 32.50.50.190
403.	Контейнеры для заготовки, хранения и транспортировки донорской крови и ее компонентов без гемоконсервантов, однокамерные (общий объем контейнера - < 500 мл), соответствующие кодам 145490, 350020 вида медицинского изделия в соответствии с номенклатурной классификацией	32.50.13.190, 32.50.50, 32.50.50.180, 32.50.50.190
404.	Контейнеры для заготовки, хранения и транспортировки донорской крови и ее компонентов без гемоконсервантов, двухкамерные, соответствующие кодам 145490, 350020 вида медицинского изделия в соответствии с номенклатурной классификацией	32.50.13.190, 32.50.50, 32.50.50.180, 32.50.50.190
405.	Контейнеры для заготовки, хранения и транспортировки донорской крови и ее компонентов с гемоконсервантом, однокамерные, соответствующие коду 144260 вида медицинского изделия в соответствии с номенклатурной классификацией	32.50.13.190, 32.50.50, 32.50.50.180, 32.50.50.190
406.	Контейнеры для заготовки, хранения и транспортировки донорской крови и ее компонентов с гемоконсервантом, двухкамерные, соответствующие коду 144270 вида медицинского изделия в соответствии с номенклатурной классификацией	32.50.13.190, 32.50.50, 32.50.50.180, 32.50.50.190
407.	Контейнеры для заготовки, хранения и транспортировки донорской крови и ее компонентов с гемоконсервантом, трехкамерные, соответствующие коду 144320 вида медицинского изделия в соответствии с номенклатурной классификацией	32.50.13.190, 32.50.50, 32.50.50.180, 32.50.50.190
408.	Контейнеры для заготовки, хранения и транспортировки донорской крови и ее компонентов с гемоконсервантом, четырехкамерные, соответствующие коду 144300 вида медицинского изделия в соответствии с номенклатурной классификацией	32.50.13.190, 32.50.50, 32.50.50.180, 32.50.50.190
409.	Контейнеры для заготовки, хранения и транспортировки донорской крови и ее компонентов с гемоконсервантом, с лейкоцитарным фильтром, трехкамерные, соответствующие коду 144320 вида медицинского изделия в соответствии с номенклатурной классификацией	32.50.13.190, 32.50.50, 32.50.50.180, 32.50.50.190
410.	Контейнеры для заготовки, хранения и транспортировки донорской крови и ее компонентов с гемоконсервантом, с лейкоцитарным фильтром, четырехкамерные, соответствующие коду 144300 вида медицинского изделия в соответствии с номенклатурной классификацией	32.50.13.190, 32.50.50, 32.50.50.180, 32.50.50.190
411.	Контейнеры для заготовки, хранения и транспортировки донорской крови и ее компонентов с гемоконсервантом и конфигурацией контейнеров "верх/низ" (T&B), трехкамерные, соответствующие коду 144320 вида медицинского изделия в соответствии с номенклатурной классификацией	32.50.13.190, 32.50.50, 32.50.50.180, 32.50.50.190
412.	Контейнеры для заготовки, хранения и транспортировки донорской крови и ее компонентов с гемоконсервантом и конфигурация контейнеров "верх/низ" (T&B), четырехкамерные, соответствующие коду 144300 вида медицинского изделия в соответствии с номенклатурной классификацией	32.50.13.190, 32.50.50, 32.50.50.180, 32.50.50.190
413.	Контейнеры для заготовки, хранения и транспортировки донорской крови и ее компонентов, с конфигурацией контейнеров "верх/низ" (T&B), с гемоконсервантом и лейкоцитарным фильтром, трехкамерные, соответствующие коду 144320 вида медицинского изделия в соответствии с номенклатурной классификацией	32.50.13.190 32.50.50, 32.50.50.180, 32.50.50.190
414.	Контейнеры для заготовки, хранения и транспортировки донорской крови и ее компонентов, с конфигурацией контейнеров "верх/низ" (T&B), с гемоконсервантом и лейкоцитарным фильтром, четырехкамерные, соответствующие коду 144300 вида медицинского изделия в соответствии с номенклатурной классификацией	32.50.13.190, 32.50.50, 32.50.50.180, 32.50.50.190
415.	Контейнеры для глубокой заморозки компонентов донорской крови (криоконсервирования), соответствующие кодам 145490, 350020 вида медицинского изделия в соответствии с номенклатурной классификацией	32.50.13.190, 32.50.50, 32.50.50.180, 32.50.50.190
416.	Контур дыхательный для наркозно-дыхательного аппарата (анестезиологический), соответствующий коду 275820 вида медицинского изделия в соответствии с номенклатурной классификацией	32.50.13.190, 32.50.50, 32.50.50.190, 32.50.13.150, 32.50.21.120, 32.50.21.121, 32.50.21.122, 32.50.21.123, 32.50.21.129
417.	Контур дыхательный для аппарата искусственной вентиляции легких, соответствующий коду 185610 вида медицинского изделия в соответствии с номенклатурной классификацией	32.50.13.190, 32.50.50, 32.50.50.190, 32.50.13.150, 32.50.21.120, 32.50.21.121, 32.50.21.122, 32.50.21.123, 32.50.21.129
